[
  {
    "id": "MA-1A-001",
    "subject": "数学",
    "name": "点数与1～5的认识",
    "kind": "概念",
    "topic_chain": {
      "chain_id": "math.number",
      "chain_name": "数的认识（整数→分数→小数）",
      "step": 10
    },
    "difficulty_level": 1,
    "textbook_refs": [
      {
        "edition": "人教版2024",
        "grade": 1,
        "term": "上",
        "unit_id": "M1A-U1",
        "unit_order": 1,
        "unit_name": "5以内数的认识和加、减法",
        "verification": "已核-双源",
        "note": "单元名来自 kb-v1 目录（教辅双源一致，非官方原件）；以孩子手里的课本为准"
      }
    ],
    "essence": "数数就是一个东西配一个数，最后数到几，一共就有几个。",
    "mastery": [
      "能手指点着数出5以内物体的个数",
      "能按数取物：说3就拿出3个",
      "能认、读、写1～5"
    ],
    "explain": {
      "scene": "桌上放3个苹果，让孩子一边摸一边数：1、2、3。最后数到3，就是一共有3个。",
      "hook": "像排队点名：每人只点一次，不漏人、不重复。",
      "steps": [
        "用手指一个一个点着数",
        "点一个，嘴里说一个数",
        "最后说的那个数，就是“一共有几个”",
        "换个顺序再数一遍，结果不变"
      ],
      "mistake": {
        "wrong": "手点得快、嘴说得慢，3个苹果数成了4个",
        "right": "手和嘴一起走，点一个说一个",
        "why": "数数要一个东西对一个数，手嘴对不上就会多数或漏数"
      }
    },
    "pitfalls": [
      "数完了问“一共几个”，又从头数一遍",
      "把5、3写反方向"
    ],
    "parent_check": "这些积木你点着数给我听，一共几个？换个顺序再数，还一样吗？",
    "status": "草稿",
    "review": {
      "by": "",
      "date": "",
      "note": "待教师审核"
    },
    "updated": "2026-10-19",
    "oral_diagnosis": {
      "questions": [
        {
          "ask": "这些积木你点着数给我听，一共几个？换个顺序再数，还一样吗？",
          "pass": "能一个一个点着数，两次结果一样，并说出最后那个数就是一共的个数",
          "misconception": "手点得快嘴慢，多数或漏数；或数完说不出一共几个"
        },
        {
          "ask": "我说 4，你拿出 4 个小东西。",
          "pass": "能按数取物，不多不少",
          "misconception": "听数和动手对不上"
        }
      ],
      "fallback": "退到：一起慢点，手点一个嘴说一个；还不会就先玩「给你 1 个、再给你 1 个」的游戏。"
    }
  },
  {
    "id": "MA-1A-002",
    "subject": "数学",
    "name": "比多少与 >、<、= 的用法",
    "kind": "规则",
    "topic_chain": {
      "chain_id": "math.number",
      "chain_name": "数的认识（整数→分数→小数）",
      "step": 20
    },
    "difficulty_level": 2,
    "textbook_refs": [
      {
        "edition": "人教版2024",
        "grade": 1,
        "term": "上",
        "unit_id": "M1A-U1",
        "unit_order": 1,
        "unit_name": "5以内数的认识和加、减法",
        "verification": "已核-双源",
        "note": "单元名来自 kb-v1 目录（教辅双源一致，非官方原件）；以孩子手里的课本为准"
      }
    ],
    "essence": "一个对一个地配对，剩下的那边多；比完用符号记下来。",
    "mastery": [
      "能用一一配对判断哪边多、哪边少",
      "能正确写出 >、<、= 比较两个数",
      "能说出“4比3大”“3比4小”"
    ],
    "explain": {
      "scene": "摆两排小碗和小勺，一个碗配一把勺。配完了，碗那边还剩一个，就是碗多。",
      "hook": "把 > 和 < 想成一张张开的嘴：嘴巴张大的那一边，朝着大的数。",
      "steps": [
        "一个一个配对，或者分别数出个数",
        "看哪边有剩下的，哪边就多",
        "写符号：开口朝大数，尖尖朝小数",
        "一样多就写 ="
      ],
      "mistake": {
        "wrong": "3 < 2",
        "right": "3 > 2",
        "why": "开口要朝着大的数，3比2大，开口就朝3"
      }
    },
    "pitfalls": [
      "只看排得长不长，不看个数（摆得松的一排看着长）",
      "“=”两条线写得一长一短"
    ],
    "parent_check": "这边 4 颗糖、那边 4 颗糖，那边摆得更开，哪边多？为什么？",
    "status": "草稿",
    "review": {
      "by": "",
      "date": "",
      "note": "待教师审核"
    },
    "updated": "2026-10-19",
    "oral_diagnosis": {
      "questions": [
        {
          "ask": "这边 4 颗糖、那边 4 颗糖，那边摆得更开，哪边多？为什么？",
          "pass": "说出一样多，因为一一配对或数出来个数相同，不是看摆得长",
          "misconception": "只看排得长就当多"
        },
        {
          "ask": "3 和 5，哪个大？用手指比一下开口朝哪边。",
          "pass": "能说出 5 大，开口朝 5",
          "misconception": "开口方向反了"
        }
      ],
      "fallback": "退到：先做一个碗配一把勺的配对游戏，不问符号。"
    }
  },
  {
    "id": "MA-1A-003",
    "subject": "数学",
    "name": "“几个”和“第几”",
    "kind": "概念",
    "topic_chain": {
      "chain_id": "math.number",
      "chain_name": "数的认识（整数→分数→小数）",
      "step": 30
    },
    "difficulty_level": 2,
    "textbook_refs": [
      {
        "edition": "人教版2024",
        "grade": 1,
        "term": "上",
        "unit_id": "M1A-U1",
        "unit_order": 1,
        "unit_name": "5以内数的认识和加、减法",
        "verification": "已核-双源",
        "note": "单元名来自 kb-v1 目录（教辅双源一致，非官方原件）；以孩子手里的课本为准"
      }
    ],
    "essence": "“几个”问一共有多少，“第几”问排在哪个位置。",
    "mastery": [
      "能分清“几个”和“第几”",
      "能按要求从左或从右数出第几个",
      "能圈出“前几个”"
    ],
    "explain": {
      "scene": "排队买早餐：你前面有2个人，你排第3；可“3个人”说的是一共有3个人。",
      "hook": "“几个”像一袋里装几颗糖，“第几”像电影票上的座位号。",
      "steps": [
        "先看清从哪边数：从左、从右、从前",
        "“第几”只圈一个",
        "“几个”要圈一堆"
      ],
      "mistake": {
        "wrong": "从左数第3个，把前3个都圈了",
        "right": "只圈从左数的第3个那一个",
        "why": "第几说的是一个位置，不是一群"
      }
    },
    "pitfalls": [
      "没看清从左还是从右数"
    ],
    "parent_check": "从右边数，第 2 个是谁？前 2 个又是哪些？",
    "status": "草稿",
    "review": {
      "by": "",
      "date": "",
      "note": "待教师审核"
    },
    "updated": "2026-10-19",
    "oral_diagnosis": {
      "questions": [
        {
          "ask": "从右边数，第 2 个是谁？前 2 个又是哪些？",
          "pass": "能分清「第 2 个」只指一个、「前 2 个」指一排里的两个",
          "misconception": "把第几和几个混成一圈"
        },
        {
          "ask": "队伍里一共几个人？你排第几？（用家里人假装排队）",
          "pass": "两个问题能分开答",
          "misconception": "用同一个数字回答两个问题"
        }
      ],
      "fallback": "退到：先只问「一共几个」，会了再问「从左边数第几个」。"
    }
  },
  {
    "id": "MA-1A-004",
    "subject": "数学",
    "name": "5以内数的分与合",
    "kind": "概念",
    "topic_chain": {
      "chain_id": "math.add_sub",
      "chain_name": "数的组成与加减法",
      "step": 10
    },
    "difficulty_level": 2,
    "textbook_refs": [
      {
        "edition": "人教版2024",
        "grade": 1,
        "term": "上",
        "unit_id": "M1A-U1",
        "unit_order": 1,
        "unit_name": "5以内数的认识和加、减法",
        "verification": "已核-双源",
        "note": "单元名来自 kb-v1 目录（教辅双源一致，非官方原件）；以孩子手里的课本为准"
      }
    ],
    "essence": "一个数可以分成两个数，两个数也能合成原来的数。",
    "mastery": [
      "能有顺序地说出 2～5 的所有分法",
      "能根据一部分说出另一部分",
      "能用小棒或豆子演示「分开」和「合上」"
    ],
    "explain": {
      "scene": "4颗草莓放进两个盘子，可以是1和3、2和2、3和1。不管怎么放，合起来还是4颗。",
      "hook": "像拆积木和拼积木：拆开、拼上，还是这几块。",
      "steps": [
        "拿出5根小棒",
        "分成两堆，说“5可以分成2和3”",
        "一根一根挪过去，按顺序找全所有分法",
        "反过来说“2和3合成5”"
      ],
      "mistake": {
        "wrong": "5可以分成2和2",
        "right": "5可以分成2和3",
        "why": "两部分合起来要还是原来那么多；检查一下，2 和 2 合起来只有 4"
      }
    },
    "pitfalls": [
      "分法找不全，因为乱找没顺序",
      "把「分」和「合」说反"
    ],
    "parent_check": "手里 5 颗豆，左手 2 颗，右手有几颗？你怎么知道的？",
    "status": "草稿",
    "review": {
      "by": "",
      "date": "",
      "note": "待教师审核"
    },
    "updated": "2026-10-19",
    "oral_diagnosis": {
      "questions": [
        {
          "ask": "手里 5 颗豆，左手 2 颗，右手有几颗？你怎么知道的？",
          "pass": "能说出 3，并说明 2 和 3 合起来是 5",
          "misconception": "乱猜；或说成 2 和 2"
        },
        {
          "ask": "4 可以怎么分成两堆？再说一种分法。",
          "pass": "能说出至少两种（如 1 和 3、2 和 2）",
          "misconception": "只会一种，或合起来不是 4"
        }
      ],
      "fallback": "退到：先一起数清每一堆有几颗，再问「两堆合起来是不是还是这么多」。"
    }
  },
  {
    "id": "MA-1A-005",
    "subject": "数学",
    "name": "加法的意思（5以内）",
    "kind": "概念",
    "topic_chain": {
      "chain_id": "math.add_sub",
      "chain_name": "数的组成与加减法",
      "step": 20
    },
    "difficulty_level": 3,
    "textbook_refs": [
      {
        "edition": "人教版2024",
        "grade": 1,
        "term": "上",
        "unit_id": "M1A-U1",
        "unit_order": 1,
        "unit_name": "5以内数的认识和加、减法",
        "verification": "已核-双源",
        "note": "单元名来自 kb-v1 目录（教辅双源一致，非官方原件）；以孩子手里的课本为准"
      }
    ],
    "essence": "把两部分合在一起，求一共有多少，就用加法。",
    "mastery": [
      "能说出加法算式里每个数在图里指什么",
      "能口算5以内的加法",
      "能根据一句话或一幅图列出加法算式"
    ],
    "explain": {
      "scene": "树上有2只小鸟，又飞来1只，现在一共几只？",
      "hook": "“+”像一根绳子，把两堆东西捆成一堆。",
      "steps": [
        "看图找“原来有几”“又来了几”",
        "合起来，用加号",
        "用分与合想结果：2和1合成3",
        "读算式：2加1等于3"
      ],
      "mistake": {
        "wrong": "看到“又飞来1只”，写成 2－1",
        "right": "2＋1＝3",
        "why": "飞来了是变多、合起来，要用加法"
      }
    },
    "pitfalls": [
      "只看数字不看事情",
      "等号位置写错，如 2＝1＋3 当成一样的算式乱写"
    ],
    "parent_check": "用「2＋3」编一个小故事讲给我听。",
    "status": "草稿",
    "review": {
      "by": "",
      "date": "",
      "note": "待教师审核"
    },
    "updated": "2026-10-19",
    "oral_diagnosis": {
      "questions": [
        {
          "ask": "用「2＋3」编一个小故事讲给我听。",
          "pass": "故事里是两堆合起来，能说出一共",
          "misconception": "故事其实是拿走，却用了加号"
        },
        {
          "ask": "盘子里有 2 块饼干，又放了 2 块，变多了还是变少了？算式怎么写？",
          "pass": "说出变多，2＋2＝4",
          "misconception": "看到数字就减"
        }
      ],
      "fallback": "退到：用豆子演示「合在一起」，先不问算式；还不会就回到分与合。"
    }
  },
  {
    "id": "MA-1A-006",
    "subject": "数学",
    "name": "减法的意思（5以内）",
    "kind": "概念",
    "topic_chain": {
      "chain_id": "math.add_sub",
      "chain_name": "数的组成与加减法",
      "step": 30
    },
    "difficulty_level": 3,
    "textbook_refs": [
      {
        "edition": "人教版2024",
        "grade": 1,
        "term": "上",
        "unit_id": "M1A-U1",
        "unit_order": 1,
        "unit_name": "5以内数的认识和加、减法",
        "verification": "已核-双源",
        "note": "单元名来自 kb-v1 目录（教辅双源一致，非官方原件）；以孩子手里的课本为准"
      }
    ],
    "essence": "从一共里拿走一部分，求还剩多少，就用减法。",
    "mastery": [
      "能说出减法算式里每个数的意思",
      "能口算5以内的减法",
      "能看图或听一句话列出减法算式"
    ],
    "explain": {
      "scene": "盘里有5块饼干，吃掉2块，还剩几块？",
      "hook": "“－”像一把小剪刀，剪掉拿走的那部分。",
      "steps": [
        "找“一共有几”",
        "找“拿走几”",
        "用分与合想：5分成2和几？是3",
        "写成 5－2＝3"
      ],
      "mistake": {
        "wrong": "2－5",
        "right": "5－2",
        "why": "减法先写“一共有几”，再写“拿走几”"
      }
    },
    "pitfalls": [
      "把剩下的当成拿走的",
      "看到“一共”两个字就用加法（如“一共5个，拿走2个”）"
    ],
    "parent_check": "桌上一共 4 个橘子，我拿走 1 个。你说算式，再说每个数是什么意思。",
    "status": "草稿",
    "review": {
      "by": "",
      "date": "",
      "note": "待教师审核"
    },
    "updated": "2026-10-19",
    "oral_diagnosis": {
      "questions": [
        {
          "ask": "桌上一共 4 个橘子，我拿走 1 个。你说算式，再说每个数是什么意思。",
          "pass": "能说 4－1＝3，并解释一共、拿走、剩下",
          "misconception": "写成 1－4，或把剩下的当成拿走的"
        },
        {
          "ask": "5 块饼干吃了 2 块，还剩几块？脑子里怎么想的？",
          "pass": "能答 3，并提到从一共里拿走",